outputs/rebuild/rebuild_mechanism_results.csv

model,dependent,variable,coef,std_err,p_value,nobs,firms,years,r2_within,engine
M3a_RD_intensity,rd_intensity,manufacturing_post2021,-0.06309126697348133,0.24047259887227185,0.7930416354344232,105787,4811,6,0.09910844184396106,PanelOLS
M3a_RD_intensity,rd_intensity,ln_assets,-0.5973849406603153,0.26078875921086825,0.021983680409729756,105787,4811,6,0.09910844184396106,PanelOLS
M3a_RD_intensity,rd_intensity,roa,-85.25761974612196,2.338528880046654,0.0,105787,4811,6,0.09910844184396106,PanelOLS
M3a_RD_intensity,rd_intensity,firm_age,0.2898689975083907,0.19852968850274,0.1442715184544976,105787,4811,6,0.09910844184396106,PanelOLS
M3a_RD_intensity,rd_intensity,rd_staff_ratio,0.20777894746969527,0.01987589901288495,0.0,105787,4811,6,0.09910844184396106,PanelOLS
M3b_RD_staff,ln_rd_staff,manufacturing_post2021,-0.18710265268533424,0.04001970199762115,2.9389754641062638e-06,124337,5262,6,0.014512354180606146,PanelOLS
M3b_RD_staff,ln_rd_staff,ln_assets,0.6348547534502929,0.0362643727695325,0.0,124337,5262,6,0.014512354180606146,PanelOLS
M3b_RD_staff,ln_rd_staff,roa,0.9387231765747197,0.10365062221209487,0.0,124337,5262,6,0.014512354180606146,PanelOLS
M3b_RD_staff,ln_rd_staff,firm_age,-0.068896535039337,0.05696330266124396,0.2264771188074175,124337,5262,6,0.014512354180606146,PanelOLS
M3c_rd_subsidy_channel,ln_invention_apply,manufacturing_post2021,-0.028902631615647417,0.02331626648710988,0.21512919368798578,124337,5262,6,-0.006169852668117537,PanelOLS
M3c_rd_subsidy_channel,ln_invention_apply,ln_assets,0.036619684705650836,0.019701652262578858,0.06307052924828693,124337,5262,6,-0.006169852668117537,PanelOLS
M3c_rd_subsidy_channel,ln_invention_apply,roa,0.008801113514650776,0.06431915114838244,0.8911614188742898,124337,5262,6,-0.006169852668117537,PanelOLS
M3c_rd_subsidy_channel,ln_invention_apply,firm_age,0.03520318476812105,0.05697371605658392,0.5366525580390828,124337,5262,6,-0.006169852668117537,PanelOLS
M3c_rd_subsidy_channel,ln_invention_apply,ln_rd_subsidy,-0.001491118258381759,0.0012477536226663728,0.23207291558235799,124337,5262,6,-0.006169852668117537,PanelOLS
M3a_RD_intensity,rd_intensity,manufacturing_post2021,-0.10696806925110128,0.23946858124526624,0.6551002945780717,108260,4819,7,0.10223548964654827,PanelOLS
M3a_RD_intensity,rd_intensity,ln_assets,-0.5147055511369534,0.2500892752658906,0.03958425758085249,108260,4819,7,0.10223548964654827,PanelOLS
M3a_RD_intensity,rd_intensity,roa,-84.03429994867349,2.2883155381383435,0.0,108260,4819,7,0.10223548964654827,PanelOLS
M3a_RD_intensity,rd_intensity,firm_age,0.33855209858824664,0.1929718775611839,0.07936296776568597,108260,4819,7,0.10223548964654827,PanelOLS
M3a_RD_intensity,rd_intensity,rd_staff_ratio,0.20617634297160262,0.01928471864667623,0.0,108260,4819,7,0.10223548964654827,PanelOLS
M3b_RD_staff,ln_rd_staff,manufacturing_post2021,-0.19360424415495692,0.04038551912840907,1.6375946636504324e-06,127617,5265,7,-0.02035642770680246,PanelOLS
M3b_RD_staff,ln_rd_staff,ln_assets,0.6477456823198214,0.036701341468124656,0.0,127617,5265,7,-0.02035642770680246,PanelOLS
M3b_RD_staff,ln_rd_staff,roa,0.9756984541848301,0.10685932452711125,0.0,127617,5265,7,-0.02035642770680246,PanelOLS
M3b_RD_staff,ln_rd_staff,firm_age,-0.09407270167526043,0.05319180874871158,0.07697046170592725,127617,5265,7,-0.02035642770680246,PanelOLS
M3c_rd_subsidy_channel,ln_invention_apply,manufacturing_post2021,-0.028964719880812107,0.02326598448728237,0.21315674132283458,127617,5265,7,-0.006922303795826146,PanelOLS
M3c_rd_subsidy_channel,ln_invention_apply,ln_assets,0.03230024133817857,0.019178426841647344,0.0921462304581453,127617,5265,7,-0.006922303795826146,PanelOLS
M3c_rd_subsidy_channel,ln_invention_apply,roa,0.022453492948779543,0.06353572400183456,0.72378957125725,127617,5265,7,-0.006922303795826146,PanelOLS
M3c_rd_subsidy_channel,ln_invention_apply,firm_age,0.03541514438959439,0.05516118921365617,0.5208548358488736,127617,5265,7,-0.006922303795826146,PanelOLS
M3c_rd_subsidy_channel,ln_invention_apply,ln_rd_subsidy,-0.0012145340594467292,0.0012140530497812896,0.31712078612582095,127617,5265,7,-0.006922303795826146,PanelOLS
M3a_RD_intensity,rd_intensity,manufacturing_post2021,-0.15509373914007268,0.25426226156326986,0.5418789934259105,154687,5252,8,0.08512843979602769,PanelOLS
M3a_RD_intensity,rd_intensity,ln_assets,-0.706470635490055,0.20239648676907637,0.0004822057338977892,154687,5252,8,0.08512843979602769,PanelOLS
M3a_RD_intensity,rd_intensity,roa,-86.3243100486445,2.1807934653923513,0.0,154687,5252,8,0.08512843979602769,PanelOLS
M3a_RD_intensity,rd_intensity,firm_age,-0.15987269428164586,0.1553713216276972,0.30349463507717056,154687,5252,8,0.08512843979602769,PanelOLS
M3a_RD_intensity,rd_intensity,rd_staff_ratio,0.23920958432060938,0.01814519432732756,0.0,154687,5252,8,0.08512843979602769,PanelOLS
M3b_RD_staff,ln_rd_staff,manufacturing_post2021,-0.18953562565417156,0.03965013929439737,1.752646305863692e-06,177645,5629,8,-0.023488943400620466,PanelOLS
M3b_RD_staff,ln_rd_staff,ln_assets,0.6507141081905881,0.027907527969179658,0.0,177645,5629,8,-0.023488943400620466,PanelOLS
M3b_RD_staff,ln_rd_staff,roa,1.0059317754824455,0.09492502428037922,0.0,177645,5629,8,-0.023488943400620466,PanelOLS
M3b_RD_staff,ln_rd_staff,firm_age,-0.08911778281051363,0.03467429697515121,0.010166588636944418,177645,5629,8,-0.023488943400620466,PanelOLS
M3c_rd_subsidy_channel,ln_invention_apply,manufacturing_post2021,-0.05085152114779466,0.022802072726132046,0.025740288844233516,177645,5629,8,0.0019977560226291935,PanelOLS
M3c_rd_subsidy_channel,ln_invention_apply,ln_assets,0.047950297415412506,0.01598278670291761,0.0026991082788707654,177645,5629,8,0.0019977560226291935,PanelOLS
M3c_rd_subsidy_channel,ln_invention_apply,roa,0.045083681822152305,0.06199575515974286,0.46710079360026846,177645,5629,8,0.0019977560226291935,PanelOLS
M3c_rd_subsidy_channel,ln_invention_apply,firm_age,0.01017806405561711,0.03773676901907702,0.7873820574701971,177645,5629,8,0.0019977560226291935,PanelOLS
M3c_rd_subsidy_channel,ln_invention_apply,ln_rd_subsidy,-0.002000940682917669,0.0009598663198248798,0.03710677859089473,177645,5629,8,0.0019977560226291935,PanelOLS
M3a_RD_intensity,rd_intensity,manufacturing_post2021,-0.356260303837141,0.2557291586984392,0.1635873775765233,125765,5210,6,0.075204750518308,PanelOLS
M3a_RD_intensity,rd_intensity,ln_assets,-0.5764458663941633,0.24448505420991662,0.018385384095467305,125765,5210,6,0.075204750518308,PanelOLS
M3a_RD_intensity,rd_intensity,roa,-87.32397665140495,2.4711123153253087,0.0,125765,5210,6,0.075204750518308,PanelOLS
M3a_RD_intensity,rd_intensity,firm_age,-0.42119313070363057,0.22106894833446547,0.05674906699199389,125765,5210,6,0.075204750518308,PanelOLS
M3a_RD_intensity,rd_intensity,rd_staff_ratio,0.227416732159479,0.01957753377565424,0.0,125765,5210,6,0.075204750518308,PanelOLS
M3b_RD_staff,ln_rd_staff,manufacturing_post2021,-0.12360362623646035,0.035058760651158226,0.0004226423848778804,141790,5606,6,0.0236737237555249,PanelOLS
M3b_RD_staff,ln_rd_staff,ln_assets,0.5868869682843102,0.02520777392679452,0.0,141790,5606,6,0.0236737237555249,PanelOLS
M3b_RD_staff,ln_rd_staff,roa,0.5924590575916179,0.07774304300740072,2.531308496145357e-14,141790,5606,6,0.0236737237555249,PanelOLS
M3b_RD_staff,ln_rd_staff,firm_age,-0.06183236404204857,0.03501588696737069,0.07742536646533549,141790,5606,6,0.0236737237555249,PanelOLS
M3c_rd_subsidy_channel,ln_invention_apply,manufacturing_post2021,-0.058325207232536584,0.02359223886979776,0.013428894064966057,141790,5606,6,-0.007170954637160554,PanelOLS
M3c_rd_subsidy_channel,ln_invention_apply,ln_assets,0.09173916667979179,0.01932485243439496,2.0644916614021014e-06,141790,5606,6,-0.007170954637160554,PanelOLS
M3c_rd_subsidy_channel,ln_invention_apply,roa,0.009558164613489274,0.06415491996016509,0.8815651502479551,141790,5606,6,-0.007170954637160554,PanelOLS
M3c_rd_subsidy_channel,ln_invention_apply,firm_age,-0.034415503995612585,0.039227771319985755,0.38031169141188115,141790,5606,6,-0.007170954637160554,PanelOLS
M3c_rd_subsidy_channel,ln_invention_apply,ln_rd_subsidy,-0.002216430126290864,0.0011098526599900176,0.04582184864737515,141790,5606,6,-0.007170954637160554,PanelOLS

outputs/rebuild/rebuild_empirical_report.md

## 三、机制检验

- M3a_RD_intensity: coef=-0.0631, se=0.2405, p=0.7930
- M3b_RD_staff: coef=-0.1871, se=0.0400, p=0.0000***
- M3c_rd_subsidy_channel: coef=-0.0289, se=0.0233, p=0.2151
- M3a_RD_intensity: coef=-0.1070, se=0.2395, p=0.6551
- M3b_RD_staff: coef=-0.1936, se=0.0404, p=0.0000***
- M3c_rd_subsidy_channel: coef=-0.0290, se=0.0233, p=0.2132
- M3a_RD_intensity: coef=-0.1551, se=0.2543, p=0.5419
- M3b_RD_staff: coef=-0.1895, se=0.0397, p=0.0000***
- M3c_rd_subsidy_channel: coef=-0.0509, se=0.0228, p=0.0257**
- M3a_RD_intensity: coef=-0.3563, se=0.2557, p=0.1636
- M3b_RD_staff: coef=-0.1236, se=0.0351, p=0.0004***
- M3c_rd_subsidy_channel: coef=-0.0583, se=0.0236, p=0.0134**